{
  "$schema": "http://json-schema.org/draft-07/schema#",
  "title": "ziptie configuration schema",
  "description": "Configuration schema for @littlevoid/ziptie system setup.",
  "type": "object",
  "properties": {
    "system": {
      "type": "object",
      "description": "General operating system configurations.",
      "properties": {
        "computerName": {
          "type": "string",
          "default": "auto",
          "description": "The target name of the computer. Defaults to 'auto' to preserve the current Windows hostname without renaming.",
          "minLength": 1
        },
        "timezone": {
          "type": "string",
          "description": "The standardized Windows Time Zone name (e.g. 'Eastern Standard Time', 'Pacific Standard Time'). Defaults to 'auto' to automatically detect and sync timezone based on Windows location services.",
          "minLength": 1
        },
        "dailyReboot": {
          "type": "boolean",
          "description": "Enables a scheduled task to reboot the computer daily at rebootTime to prevent memory leaks and maintain exhibit stability."
        },
        "rebootTime": {
          "type": "string",
          "description": "The time of day in HH:MM (24-hour format) when the daily reboot occurs (Default: '06:00').",
          "pattern": "^([0-1]?[0-9]|2[0-3]):[0-5][0-9]$"
        },
        "rebootOnFinish": {
          "type": "boolean",
          "description": "Automatically reboots the computer at the end of the ziptie run if a change was made, without prompting (Default: false)."
        }
      },
      "required": ["computerName", "timezone", "dailyReboot", "rebootTime", "rebootOnFinish"]
    },
    "autologon": {
      "type": "object",
      "description": "Configure automatic user login on Windows boot.",
      "properties": {
        "enabled": {
          "type": "boolean",
          "description": "Enables automatic login for the specified username."
        },
        "username": {
          "type": "string",
          "default": "auto",
          "description": "The local Windows account name that should automatically log in on boot (e.g. 'exhibit'). Defaults to 'auto' to dynamically use the currently logged-in Windows user account at runtime."
        },
        "disablePasswordlessHello": {
          "type": "boolean",
          "description": "Required on Windows 11 to disable Windows Hello passwordless credential requirements so standard Autologon works properly."
        }
      },
      "required": ["enabled", "disablePasswordlessHello"]
    },
    "startupTask": {
      "type": "object",
      "description": "Creates a scheduled task in the active user graphics session to launch the exhibit application.",
      "properties": {
        "enabled": {
          "type": "boolean",
          "description": "Enables creating/managing the exhibit startup scheduled task."
        },
        "workingDir": {
          "type": "string",
          "default": "auto",
          "description": "The working directory from which the executable should be launched. Defaults to 'auto' (or '.') to dynamically resolve to the directory containing ziptie.config.json at runtime."
        },
        "executable": {
          "type": "string",
          "description": "The path or file name of the executable or script to run (e.g. 'launch.bat', 'app.exe', or 'node'). If 'args' is not provided, this field will be parsed for arguments automatically."
        },
        "args": {
          "type": "array",
          "items": {
            "type": "string"
          },
          "description": "Optional command-line arguments to pass to the executable as an array of strings (e.g. ['index.js', '--port', '3000']). If specified, 'executable' is treated strictly as the command/file path without any regex argument parsing."
        },
        "trigger": {
          "type": "string",
          "enum": ["AtLogon", "AtStartup"],
          "description": "The schedule trigger constraint. Defaults to 'AtLogon' (Recommended) to run the app in the active, visible graphical session. 'AtStartup' runs headlessly in background Session 0 (discouraged for UI apps)."
        },
        "delay": {
          "type": "string",
          "description": "ISO 8601 duration string specifying how long to wait after boot/logon before starting the application. Defaults to 'PT1M' (1 minute) to allow desktop and graphics services to settle.",
          "pattern": "^PT([0-9]+[HMS])+$"
        }
      },
      "required": ["enabled", "workingDir", "executable", "trigger", "delay"]
    },
    "packageManager": {
      "type": "object",
      "description": "Manage application installations for the system.",
      "properties": {
        "provider": {
          "type": "string",
          "enum": ["winget", "choco", "none"],
          "description": "The system package manager. 'winget' uses the built-in Windows 11 package manager. 'choco' uses Chocolatey. 'none' disables online package manager downloads."
        },
        "allowOfflineFallback": {
          "type": "boolean",
          "description": "If true, scans the local installers path for .msi/.exe installers and runs them silently, bypassing online downloads entirely if internet is unavailable."
        },
        "localInstallersPath": {
          "type": "string",
          "description": "The path to the folder containing offline silent installers, relative to the run root (e.g. '.\\installers')."
        },
        "apps": {
          "type": "array",
          "items": {
            "type": "string"
          },
          "description": "List of official Winget package IDs to install when online (e.g. ['Git.Git', 'Node.js'])."
        }
      },
      "required": ["provider", "allowOfflineFallback", "localInstallersPath", "apps"]
    },
    "windows": {
      "type": "object",
      "description": "Windows OS settings.",
      "properties": {
        "disableScreensaver": {
          "type": "boolean",
          "description": "Disables screensavers globally for all users."
        },
        "disableAccessibilityShortcuts": {
          "type": "boolean",
          "description": "Disables accessibility keyboard shortcuts (e.g. Sticky Keys, Filter Keys) to prevent visitors from bypassing the kiosk."
        },
        "disableEdgeSwipes": {
          "type": "boolean",
          "description": "Disables Edge Swipes (swiping from edge of touch screen to open notification/widget panel)."
        },
        "disableTouchFeedback": {
          "type": "boolean",
          "description": "Disables visual touch circle feedback on modern Windows touchscreen devices."
        },
        "disableSystemSounds": {
          "type": "boolean",
          "description": "Disables all Windows operating system audio feedback and system event sounds (e.g. error pings, volume slider change sounds) globally."
        },
        "disableWindowsUpdate": {
          "type": "boolean",
          "description": "Writes Local Group Policy registry overrides to pause/stop automatic Windows Updates, preserving stable hardware and software states."
        },
        "disableWindowsWidgets": {
          "type": "boolean",
          "description": "Removes/disables modern Windows 11 widgets panel and taskbar widget icons to prevent visitor interaction."
        },
        "disableCopilotRecall": {
          "type": "boolean",
          "description": "Disables Windows 11 AI features including Windows Copilot and local AI data analysis (Recall) to ensure kiosk privacy."
        },
        "disableOOBEPrompts": {
          "type": "boolean",
          "description": "Disables post-update and secondary Windows Out-Of-Box Experience prompts (personalized ads, MS Account reminders)."
        },
        "clearDesktopIcons": {
          "type": "boolean",
          "description": "Hides all icons on the desktop for a clean, premium visual aesthetic."
        },
        "solidColorBackground": {
          "oneOf": [
            {
              "type": "string",
              "pattern": "^#([A-Fa-f0-9]{6})$",
              "description": "Premium hex-based solid background color (e.g. '#000000')."
            },
            {
              "type": "boolean",
              "description": "Set to true to default to solid black ('#000000'), or false to skip background customization."
            },
            {
              "type": "null"
            }
          ],
          "description": "Configures a solid color desktop background (e.g., '#000000' or true) to prevent background flashes during exhibit boot/relaunch."
        },
        "enableDarkMode": {
          "type": "boolean",
          "description": "Enables Windows 11 system-wide Dark Mode by default for a clean, premium visual aesthetic."
        },
        "configureExplorer": {
          "type": "boolean",
          "description": "Configures Windows Explorer defaults (show file extensions, show hidden files, configure taskbar, hide 3D Objects/Music/Videos folders, etc.) for exhibits."
        },
        "disableAppInstalls": {
          "type": "boolean",
          "description": "Prevents Windows from auto-installing suggested and promotional consumer applications (bloatware)."
        },
        "disableAppRestore": {
          "type": "boolean",
          "description": "Disables automatic restart/restoration of applications on startup after a system reboot."
        },
        "disableErrorReporting": {
          "type": "boolean",
          "description": "Disables Windows Error Reporting prompts and logs to prevent interactive dialog boxes on error."
        },
        "disableFirewall": {
          "type": "boolean",
          "description": "Disables the Windows Defender Firewall. Useful for strictly private air-gapped networks, but use with caution."
        },
        "disableMaxPathLength": {
          "type": "boolean",
          "description": "Disables the legacy 260-character path length limit (enables LongPathsEnabled)."
        },
        "disableNewNetworkWindow": {
          "type": "boolean",
          "description": "Disables the 'Do you want your PC to be discoverable' network prompt when connecting to new networks."
        },
        "disableNotifications": {
          "type": "boolean",
          "description": "Disables Windows Toast Notifications and Notification Center."
        },
        "disableTouchGestures": {
          "type": "boolean",
          "description": "Disables advanced multi-finger touch gestures to prevent users from exiting the kiosk app."
        },
        "enableScriptExecution": {
          "type": "boolean",
          "description": "Enables PowerShell script execution policy to RemoteSigned."
        },
        "resetTextScale": {
          "type": "boolean",
          "description": "Resets the Windows display DPI text scaling factor to 100% to ensure correct graphical layouts."
        },
        "uninstallBloatware": {
          "type": "boolean",
          "description": "Uninstalls default Windows consumer UWP packages and provisioned bloatware."
        },
        "uninstallOneDrive": {
          "type": "boolean",
          "description": "Completely uninstalls Microsoft OneDrive client."
        },
        "unpinStartMenuApps": {
          "type": "boolean",
          "description": "Unpins default pinned items from the Start Menu (supported on Windows 10 only; skipped on Windows 11)."
        },
        "setPowerSettings": {
          "type": "boolean",
          "description": "Enables optimized exhibit power settings (never sleep, never turn off screen, disable hibernating)."
        }
      },
      "required": [
        "disableScreensaver",
        "disableAccessibilityShortcuts",
        "disableEdgeSwipes",
        "disableTouchFeedback",
        "disableSystemSounds",
        "disableWindowsUpdate",
        "disableWindowsWidgets",
        "disableCopilotRecall",
        "disableOOBEPrompts",
        "clearDesktopIcons",
        "solidColorBackground",
        "enableDarkMode",
        "configureExplorer",
        "disableAppInstalls",
        "disableAppRestore",
        "disableErrorReporting",
        "disableFirewall",
        "disableMaxPathLength",
        "disableNewNetworkWindow",
        "disableNotifications",
        "disableTouchGestures",
        "enableScriptExecution",
        "resetTextScale",
        "uninstallBloatware",
        "uninstallOneDrive",
        "unpinStartMenuApps",
        "setPowerSettings"
      ]
    }
  },
  "required": ["system", "autologon", "startupTask", "packageManager", "windows"]
}

