{
  "$schema": "https://raw.githubusercontent.com/littlevoid-io/ziptie/main/ziptie.schema.json",
  "system": {
    "computerName": "auto",
    "timezone": "auto",
    "dailyReboot": true,
    "rebootTime": "06:00",
    "rebootOnFinish": false
  },
  "autologon": {
    "enabled": true,
    "username": "auto",
    "disablePasswordlessHello": true
  },
  "startupTask": {
    "enabled": true,
    "workingDir": "auto",
    "executable": "launch.bat",
    "args": [],
    "trigger": "AtLogon",
    "delay": "PT1M"
  },
  "packageManager": {
    "provider": "winget",
    "allowOfflineFallback": true,
    "localInstallersPath": ".\\installers",
    "apps": [
      "CoreyButler.NVMforWindows",
      "Microsoft.VisualStudioCode",
      "Git.Git"
    ]
  },
  "windows": {
    "disableScreensaver": true,
    "disableAccessibilityShortcuts": true,
    "disableEdgeSwipes": true,
    "disableTouchFeedback": true,
    "disableSystemSounds": true,
    "disableWindowsUpdate": true,
    "disableWindowsWidgets": true,
    "disableCopilotRecall": true,
    "disableOOBEPrompts": true,
    "clearDesktopIcons": true,
    "solidColorBackground": "#333333",
    "enableDarkMode": true,
    "configureExplorer": true,
    "disableAppInstalls": true,
    "disableAppRestore": true,
    "disableErrorReporting": true,
    "disableFirewall": false,
    "disableMaxPathLength": true,
    "disableNewNetworkWindow": true,
    "disableNotifications": true,
    "disableTouchGestures": true,
    "enableScriptExecution": true,
    "resetTextScale": true,
    "uninstallBloatware": true,
    "uninstallOneDrive": true,
    "unpinStartMenuApps": true,
    "setPowerSettings": true
  }
}